{
  "id": "1239",
  "order_id": "1-2",
  "check": "1",
  "amount": "5.50",
  "card_desc": "",
  "transaction_id": "",
  "refunded": "0",
  "refund_notes": "",
  "refunded_by": "0",
  "refund_pnref": "",
  "tip_amount": "",
  "auth": "0",
  "loc_id": "9",
  "processed": "0",
  "auth_code": "",
  "card_type": "",
  "datetime": "2011-10-10 11:50:38",
  "pay_type": "Cash",
  "voided": "0",
  "void_notes": "",
  "voided_by": "0",
  "void_pnref": "",
  "register": "receipt",
  "got_response": "0",
  "transtype": "",
  "split_tender_id": "",
  "temp_data": "",
  "change": "",
  "total_collected": "5.50",
  "record_no": "",
  "server_name": "Ancori",
  "action": "Sale",
  "ref_data": "",
  "process_data": "",
  "voice_auth": "0",
  "server_id": "15",
  "preauth_id": "",
  "tip_for_id": "0",
  "swipe_grade": "",
  "batch_no": "",
  "register_name": "receipt",
  "pay_type_id": "1",
  "first_four": "",
  "mpshc_pid": "",
  "server_time": "2011-10-10 12:49:26",
  "info": "",
  "signature": "0"
}